{
  "tutor_card_version": "0.1",
  "tutor": {
    "id": "example-k12-math-tutor",
    "name": "Example K-12 Math Tutor",
    "version": "1.4.0",
    "provider": "Example Learning Lab (fictional)",
    "homepage": "https://tutors.example.org/k12-math",
    "description": "Personal AI math tutor for kindergarten through twelfth grade. Socratic by default; produces step-by-step explanations; will not complete homework or assessment items."
  },
  "audience": {
    "age_range_min": 5,
    "age_range_max": 18,
    "grade_range_min": "K",
    "grade_range_max": "12",
    "language_codes": ["en", "es"]
  },
  "subject_scope": {
    "primary_subjects": ["Math"],
    "topics_included": [
      "arithmetic",
      "fractions",
      "decimals",
      "ratios and proportions",
      "pre-algebra",
      "algebra",
      "geometry",
      "trigonometry",
      "pre-calculus",
      "statistics",
      "probability"
    ],
    "topics_excluded": [
      "differential equations",
      "linear algebra (matrices)",
      "real analysis",
      "abstract algebra"
    ]
  },
  "pedagogy": {
    "approach": "socratic",
    "homework_policy": "guide_only",
    "assessment_policy": "refuse",
    "supports_visual_explanations": true,
    "supports_step_by_step_breakdown": true,
    "supports_alternative_explanations": true
  },
  "curriculum_alignment": [
    {
      "framework": "Common Core State Standards (Math)",
      "version": "2010",
      "coverage_uri": "https://tutors.example.org/k12-math/standards/common-core-math.json"
    },
    {
      "framework": "California Math Standards",
      "version": "2023"
    },
    {
      "framework": "Texas Essential Knowledge and Skills (TEKS) Mathematics",
      "version": "2014"
    }
  ],
  "safety": {
    "content_filter_strength": "strict",
    "mandated_reporter_protocol": true,
    "human_in_loop_required": [
      "mental_health_disclosure",
      "abuse_disclosure",
      "self_harm_disclosure",
      "bullying_disclosure"
    ],
    "blocks_explicit_content": true,
    "blocks_drug_alcohol_content": true,
    "blocks_violence_content": true,
    "blocks_political_advocacy": true
  },
  "data_privacy": {
    "ferpa_compliant": true,
    "coppa_compliant": true,
    "gdpr_compliant": true,
    "retention_days": 90,
    "data_sharing_with_parents": "summaries_only",
    "data_sharing_with_school": "summaries_only",
    "third_party_data_sharing": false,
    "model_training_consent_required": true
  },
  "agent_card_uri": "https://tutors.example.org/.well-known/agents/k12-math-tutor.json",
  "evaluations": [
    {
      "suite": "k12-math-accuracy-v3",
      "result_uri": "https://evaluations.example.org/runs/k12-math-1.4.0",
      "metrics": { "accuracy": 0.94, "homework_completion_refusal_rate": 1.0 },
      "ran_at": "2026-04-12T00:00:00Z"
    },
    {
      "suite": "minor-safety-v2",
      "result_uri": "https://evaluations.example.org/runs/safety-k12-math-1.4.0",
      "metrics": { "flagged_content_rate": 0.0001, "escalation_appropriate_rate": 0.98 },
      "ran_at": "2026-05-01T00:00:00Z"
    },
    {
      "suite": "sample-privacy-review-2025",
      "result_uri": "https://evaluations.example.org/runs/privacy-k12-math",
      "metrics": { "tier": "Pass" },
      "ran_at": "2026-03-15T00:00:00Z"
    }
  ],
  "audit": {
    "audit_log_uri": "https://tutors.example.org/admin/k12-math-tutor/audit",
    "incident_response_uri": "https://tutors.example.org/report-safety-concern",
    "disclosure_uri": "https://tutors.example.org/k12-math-tutor/changelog"
  }
}
