{
  "tutor_card_version": "0.1",
  "tutor": {
    "id": "example-college-cs-assistant",
    "name": "Example College CS Assistant",
    "version": "2.1.0",
    "provider": "Example Learning Lab (fictional)",
    "homepage": "https://tutors.example.org/college-cs",
    "description": "Computer science teaching assistant for undergraduate courses. Explains concepts, debugs student code, refuses to write submitted assignments. Optimized for CS1/CS2/Algorithms/Systems courses."
  },
  "audience": {
    "age_range_min": 17,
    "age_range_max": 99,
    "grade_range_min": "undergrad",
    "grade_range_max": "grad",
    "language_codes": ["en"]
  },
  "subject_scope": {
    "primary_subjects": ["Computer Science"],
    "topics_included": [
      "introductory programming (Python, Java, C++)",
      "data structures",
      "algorithms",
      "computer systems",
      "operating systems",
      "computer networks",
      "databases",
      "software engineering practices",
      "version control"
    ],
    "topics_excluded": [
      "graduate research thesis writing",
      "production code review for paid work",
      "answers to currently-active take-home exams"
    ]
  },
  "pedagogy": {
    "approach": "mixed",
    "homework_policy": "guide_only",
    "assessment_policy": "refuse",
    "supports_visual_explanations": true,
    "supports_step_by_step_breakdown": true,
    "supports_alternative_explanations": true
  },
  "curriculum_alignment": [
    {
      "framework": "ACM/IEEE Computing Curricula 2020 (CC2020)",
      "version": "2020"
    },
    {
      "framework": "ABET Computer Science Program Criteria",
      "version": "2024-25"
    }
  ],
  "safety": {
    "content_filter_strength": "light",
    "mandated_reporter_protocol": false,
    "human_in_loop_required": [
      "academic_integrity_concern",
      "mental_health_crisis"
    ],
    "blocks_explicit_content": true,
    "blocks_drug_alcohol_content": false,
    "blocks_violence_content": false,
    "blocks_political_advocacy": true
  },
  "data_privacy": {
    "ferpa_compliant": true,
    "coppa_compliant": false,
    "gdpr_compliant": true,
    "retention_days": 365,
    "data_sharing_with_parents": "none",
    "data_sharing_with_school": "full_transcript",
    "third_party_data_sharing": false,
    "model_training_consent_required": true
  },
  "agent_card_uri": "https://tutors.example.org/.well-known/agents/college-cs-assistant.json",
  "evaluations": [
    {
      "suite": "cs-debug-accuracy-v4",
      "result_uri": "https://evaluations.example.org/runs/college-cs-2.1.0",
      "metrics": { "bug_localization_accuracy": 0.88, "assignment_completion_refusal_rate": 0.97 },
      "ran_at": "2026-05-05T00:00:00Z"
    },
    {
      "suite": "academic-integrity-stress-v1",
      "result_uri": "https://evaluations.example.org/runs/integrity-college-cs-2.1.0",
      "metrics": { "complete_assignment_attempts_blocked": 0.97 },
      "ran_at": "2026-05-06T00:00:00Z"
    }
  ],
  "audit": {
    "audit_log_uri": "https://tutors.example.org/admin/college-cs-assistant/audit",
    "incident_response_uri": "https://tutors.example.org/report-safety-concern",
    "disclosure_uri": "https://tutors.example.org/college-cs-assistant/changelog"
  }
}
